{
  "schema_id": "https://w3id.org/abc/schemas/parser-rq-site-policy.schema.json",
  "schema_version": "1.0.0",
  "policy_hash": "sha256:828b26553a4e427f0f26a865caffbf0ae2b749ac98ad558ad406556fbd8a307f",
  "stable_host_label": "hinoki.hyakutake-barbel.ts.net",
  "kernel_hostname": "hinoki",
  "production_graph_version": "abc/parser-rq-production-graph/v1",
  "primary_failure_domain": "hinoki-primary",
  "replica_status": "unconfigured",
  "remote_filesystem_allowlist": ["nfs", "nfs4", "cifs", "ceph", "fuse.sshfs"]
}
